Page Name,URL Slug,Meta Title,Meta Description,H1 Tag (Unique per page),H2 Tags,H3 Tags,H4 Tags,Body Keywords,Content Optimization (Plagiarism / Grammar / Density),Navigational Links,Engaging Visuals & Alt Text,Schema Markup Type
Home,/,Premium Clothing & Fashion for Men Women & Kids | Clothify,"Shop sustainable, ethical, and premium fashion clothing at Clothify. Explore our latest collection of premium clothing and accessories.",Ethical and Sustainable Premium Fashion Clothing for Men Women and Kids,"Shop by Category, Featured Products, Our Values, Customer Reviews","Men's Fashion, Women's Fashion, Kids Clothing, Accessories","Free Shipping, Secure Payment, 24/7 Support","premium clothing, ethical fashion, sustainable fashion, men, women, kids, accessories, clothify","100% Unique, Zero Grammar Errors, 1-2% Keyword Density","Instagram, Facebook, Twitter, Pinterest","Hero Banner (Alt: Premium ethical clothing collection for men and women), Category images","Organization, WebSite"
About Us,/about-clothify-sustainable-fashion,About Clothify | Ethical & Sustainable Premium Fashion,"Learn about Clothify's commitment to quality, sustainable, and ethical premium fashion clothing for men, women, and kids.",About Clothify: Ethical & Sustainable Premium Fashion,"Our Story, Our Mission & Values, Sustainable Practices, Ethical Manufacturing","Quality Materials, Fair Trade, Community Impact",Join Our Team,"ethical fashion, sustainable, premium clothing, manufacturing, timeless design, quality materials","100% Unique, Zero Grammar Errors, 1-2% Keyword Density","Instagram, Facebook, Twitter, LinkedIn","Team or Factory Image (Alt: Clothify team working on ethical sustainable fashion)","AboutPage, Organization"
Products (Collection),/premium-clothing-collection,Shop Premium Clothing & Ethical Fashion | Clothify,"Browse Clothify's extensive collection of premium clothing, ethical fashion, and sustainable apparel for men, women, and kids.",Shop Premium Clothing for Men Women & Kids,"Filter by Category, New Arrivals, Best Sellers, Trending Accessories","Price Range, Colors, Sizes",Clear Filters,"shop premium clothing, buy ethical fashion, sustainable apparel, fashionable accessories","100% Unique, Zero Grammar Errors, 1.5% Keyword Density","Instagram, Facebook, Pinterest","Grid Images (Alt: [Product Name] - Premium sustainable clothing)","CollectionPage, ItemList"
Single Product Example,/product/[product-name-keyword],[Product Name] - Premium Ethical Clothing | Clothify,"Buy [Product Name] at Clothify. Made from sustainable materials, this premium clothing item is perfect for your wardrobe.",[Product Name],"Product Details, Customer Reviews, Related Products","Specifications, Sizing Guide, Material Info",Leave a Review,"[Product Name], premium [category], sustainable [category], ethical fashion","100% Unique, Zero Grammar Errors, 2% Keyword Density","Instagram, Pinterest, Facebook, X","Multiple High-Res Images (Alt: [Product Name] front view premium clothing)","Product, Offer, AggregateRating, Review"
Blog,/sustainable-fashion-blog,Sustainable & Ethical Fashion Blog | Clothify,"Read the latest tips, trends, and news on sustainable fashion and premium clothing on the Clothify blog.",Clothify Blog: Insights on Sustainable & Ethical Fashion,"Latest Articles, Featured Posts, Fashion Tips, Sustainability News",Subscribe to Newsletter,Read More,"sustainable fashion blog, ethical clothing news, premium fashion trends, style guide","100% Unique, Zero Grammar Errors, 1.5% Keyword Density","Instagram, Pinterest, Twitter","Article Thumbnails (Alt: [Article Title] - sustainable fashion trends)","Blog, BlogPosting"
Contact Us,/contact-clothify,Contact Clothify | Customer Support & Inquiries,"Get in touch with Clothify for any questions about our premium clothing, ethical fashion practices, or your orders. We're here to help!",Contact Clothify Support,"Send Us a Message, Frequently Asked Questions, Our Location","Business Hours, Social Media",Submit Request,"contact clothify, customer support, premium fashion inquiries, sustainable clothing brand contact","100% Unique, Zero Grammar Errors, 1% Keyword Density","Instagram, Facebook, Twitter, Support Portal","Support Team Image (Alt: Clothify customer support team ready to help)",ContactPage
